{
  "$schema": "https://json-schema.org/draft/2020-12/schema",
  "type": "object",
  "properties": {
    "clientActionId": {
      "type": "string",
      "format": "uuid",
      "pattern": "^([0-9a-fA-F]{8}-[0-9a-fA-F]{4}-[1-8][0-9a-fA-F]{3}-[89abAB][0-9a-fA-F]{3}-[0-9a-fA-F]{12}|00000000-0000-0000-0000-000000000000|ffffffff-ffff-ffff-ffff-ffffffffffff)$"
    },
    "expectedSequence": {
      "type": "integer",
      "minimum": 0,
      "maximum": 9007199254740991
    },
    "envelope": {
      "type": "object",
      "properties": {
        "action": {
          "oneOf": [
            {
              "type": "object",
              "properties": {
                "type": {
                  "type": "string",
                  "const": "confirm_safety"
                },
                "checklistItemIds": {
                  "type": "array",
                  "items": {
                    "type": "string",
                    "pattern": "^[a-z][a-z0-9_]*$"
                  }
                }
              },
              "required": [
                "type",
                "checklistItemIds"
              ],
              "additionalProperties": false
            },
            {
              "type": "object",
              "properties": {
                "type": {
                  "type": "string",
                  "const": "select_apparatus"
                },
                "apparatusIds": {
                  "minItems": 1,
                  "type": "array",
                  "items": {
                    "type": "string",
                    "pattern": "^[a-z][a-z0-9_]*$"
                  }
                }
              },
              "required": [
                "type",
                "apparatusIds"
              ],
              "additionalProperties": false
            },
            {
              "type": "object",
              "properties": {
                "type": {
                  "type": "string",
                  "const": "clean_glassware"
                },
                "apparatusIds": {
                  "minItems": 1,
                  "type": "array",
                  "items": {
                    "type": "string",
                    "pattern": "^[a-z][a-z0-9_]*$"
                  }
                }
              },
              "required": [
                "type",
                "apparatusIds"
              ],
              "additionalProperties": false
            },
            {
              "type": "object",
              "properties": {
                "type": {
                  "type": "string",
                  "const": "weigh_watch_glass"
                }
              },
              "required": [
                "type"
              ],
              "additionalProperties": false
            },
            {
              "type": "object",
              "properties": {
                "type": {
                  "type": "string",
                  "const": "set_balance_sliders"
                },
                "mass": {
                  "type": "object",
                  "properties": {
                    "value": {
                      "type": "number",
                      "minimum": 0
                    },
                    "unit": {
                      "type": "string",
                      "enum": [
                        "g",
                        "kg"
                      ]
                    }
                  },
                  "required": [
                    "value",
                    "unit"
                  ],
                  "additionalProperties": false
                }
              },
              "required": [
                "type",
                "mass"
              ],
              "additionalProperties": false
            },
            {
              "type": "object",
              "properties": {
                "type": {
                  "type": "string",
                  "const": "add_solid"
                },
                "mass": {
                  "type": "object",
                  "properties": {
                    "value": {
                      "type": "number",
                      "minimum": 0
                    },
                    "unit": {
                      "type": "string",
                      "enum": [
                        "g",
                        "kg"
                      ]
                    }
                  },
                  "required": [
                    "value",
                    "unit"
                  ],
                  "additionalProperties": false
                },
                "handContact": {
                  "type": "boolean"
                }
              },
              "required": [
                "type",
                "mass",
                "handContact"
              ],
              "additionalProperties": false
            },
            {
              "type": "object",
              "properties": {
                "type": {
                  "type": "string",
                  "const": "remove_solid"
                },
                "mass": {
                  "type": "object",
                  "properties": {
                    "value": {
                      "type": "number",
                      "minimum": 0
                    },
                    "unit": {
                      "type": "string",
                      "enum": [
                        "g",
                        "kg"
                      ]
                    }
                  },
                  "required": [
                    "value",
                    "unit"
                  ],
                  "additionalProperties": false
                },
                "handContact": {
                  "type": "boolean"
                }
              },
              "required": [
                "type",
                "mass",
                "handContact"
              ],
              "additionalProperties": false
            },
            {
              "type": "object",
              "properties": {
                "type": {
                  "type": "string",
                  "const": "place_funnel"
                }
              },
              "required": [
                "type"
              ],
              "additionalProperties": false
            },
            {
              "type": "object",
              "properties": {
                "type": {
                  "type": "string",
                  "const": "transfer_solid"
                },
                "fractionIntoFunnel": {
                  "type": "number",
                  "exclusiveMinimum": 0,
                  "maximum": 1
                },
                "handContact": {
                  "type": "boolean"
                }
              },
              "required": [
                "type",
                "fractionIntoFunnel",
                "handContact"
              ],
              "additionalProperties": false
            },
            {
              "type": "object",
              "properties": {
                "type": {
                  "type": "string",
                  "const": "rinse_watch_glass"
                },
                "source": {
                  "type": "string",
                  "enum": [
                    "distilled",
                    "tap"
                  ]
                }
              },
              "required": [
                "type",
                "source"
              ],
              "additionalProperties": false
            },
            {
              "type": "object",
              "properties": {
                "type": {
                  "type": "string",
                  "const": "rinse_funnel"
                },
                "source": {
                  "type": "string",
                  "enum": [
                    "distilled",
                    "tap"
                  ]
                }
              },
              "required": [
                "type",
                "source"
              ],
              "additionalProperties": false
            },
            {
              "type": "object",
              "properties": {
                "type": {
                  "type": "string",
                  "const": "remove_funnel"
                }
              },
              "required": [
                "type"
              ],
              "additionalProperties": false
            },
            {
              "type": "object",
              "properties": {
                "type": {
                  "type": "string",
                  "const": "add_water"
                },
                "volume": {
                  "type": "object",
                  "properties": {
                    "value": {
                      "type": "number",
                      "minimum": 0
                    },
                    "unit": {
                      "type": "string",
                      "enum": [
                        "cm3",
                        "dm3"
                      ]
                    }
                  },
                  "required": [
                    "value",
                    "unit"
                  ],
                  "additionalProperties": false
                },
                "source": {
                  "type": "string",
                  "enum": [
                    "distilled",
                    "tap"
                  ]
                }
              },
              "required": [
                "type",
                "volume",
                "source"
              ],
              "additionalProperties": false
            },
            {
              "type": "object",
              "properties": {
                "type": {
                  "type": "string",
                  "const": "stopper_flask"
                },
                "inserted": {
                  "type": "boolean"
                }
              },
              "required": [
                "type",
                "inserted"
              ],
              "additionalProperties": false
            },
            {
              "type": "object",
              "properties": {
                "type": {
                  "type": "string",
                  "const": "dissolve_solute"
                },
                "grip": {
                  "type": "string",
                  "enum": [
                    "neck",
                    "body"
                  ]
                }
              },
              "required": [
                "type",
                "grip"
              ],
              "additionalProperties": false
            },
            {
              "type": "object",
              "properties": {
                "type": {
                  "type": "string",
                  "const": "adjust_to_mark"
                },
                "source": {
                  "type": "string",
                  "enum": [
                    "distilled",
                    "tap"
                  ]
                },
                "eyeLevel": {
                  "type": "string",
                  "enum": [
                    "level",
                    "above",
                    "below"
                  ]
                }
              },
              "required": [
                "type",
                "source",
                "eyeLevel"
              ],
              "additionalProperties": false
            },
            {
              "type": "object",
              "properties": {
                "type": {
                  "type": "string",
                  "const": "mix_solution"
                },
                "inversions": {
                  "type": "integer",
                  "minimum": 1,
                  "maximum": 100
                },
                "grip": {
                  "type": "string",
                  "enum": [
                    "neck",
                    "body"
                  ]
                }
              },
              "required": [
                "type",
                "inversions",
                "grip"
              ],
              "additionalProperties": false
            },
            {
              "type": "object",
              "properties": {
                "type": {
                  "type": "string",
                  "const": "apply_label"
                },
                "solutionName": {
                  "type": "string",
                  "maxLength": 80
                },
                "concentration": {
                  "anyOf": [
                    {
                      "type": "object",
                      "properties": {
                        "value": {
                          "type": "number"
                        },
                        "unit": {
                          "type": "string",
                          "enum": [
                            "g",
                            "kg",
                            "cm3",
                            "dm3",
                            "mol",
                            "mol dm-3",
                            "g mol-1"
                          ]
                        }
                      },
                      "required": [
                        "value",
                        "unit"
                      ],
                      "additionalProperties": false
                    },
                    {
                      "type": "null"
                    }
                  ]
                },
                "preparationDate": {
                  "anyOf": [
                    {
                      "type": "string",
                      "format": "date",
                      "pattern": "^(?:(?:\\d\\d[2468][048]|\\d\\d[13579][26]|\\d\\d0[48]|[02468][048]00|[13579][26]00)-02-29|\\d{4}-(?:(?:0[13578]|1[02])-(?:0[1-9]|[12]\\d|3[01])|(?:0[469]|11)-(?:0[1-9]|[12]\\d|30)|(?:02)-(?:0[1-9]|1\\d|2[0-8])))$"
                    },
                    {
                      "type": "null"
                    }
                  ]
                }
              },
              "required": [
                "type",
                "solutionName",
                "concentration",
                "preparationDate"
              ],
              "additionalProperties": false
            },
            {
              "type": "object",
              "properties": {
                "type": {
                  "type": "string",
                  "const": "request_hint"
                }
              },
              "required": [
                "type"
              ],
              "additionalProperties": false
            },
            {
              "type": "object",
              "properties": {
                "type": {
                  "type": "string",
                  "const": "submit_experiment"
                }
              },
              "required": [
                "type"
              ],
              "additionalProperties": false
            },
            {
              "type": "object",
              "properties": {
                "type": {
                  "type": "string",
                  "const": "restart_experiment"
                }
              },
              "required": [
                "type"
              ],
              "additionalProperties": false
            }
          ]
        },
        "actor": {
          "type": "string",
          "enum": [
            "student",
            "system"
          ]
        },
        "acknowledgedSafetyWarning": {
          "type": "boolean"
        }
      },
      "required": [
        "action",
        "actor",
        "acknowledgedSafetyWarning"
      ],
      "additionalProperties": false
    },
    "preview": {
      "type": "boolean"
    }
  },
  "required": [
    "clientActionId",
    "expectedSequence",
    "envelope",
    "preview"
  ],
  "additionalProperties": false
}
